{
  "schema": "ThresholdPresentationV1",
  "room": {
    "awakened": true,
    "boundaryState": "boundless",
    "atmosphereState": "calm_hopeful_boundless_bright_warm"
  },
  "note": {
    "text": "the word",
    "visible": true,
    "material": "ink_warmed_by_heartlight"
  },
  "heartlight": {
    "awake": true,
    "intensity": 1,
    "color": "pearl-gold placeholder",
    "bloom": 0.815
  },
  "portal": {
    "open": true,
    "material": "threshold_rim_light"
  },
  "toolSigils": {
    "visible": [
      {
        "id": "key_of_portals",
        "name": "Key of Portals",
        "effect": "opens_dream_transition",
        "material": "key_of_portals_sigil_placeholder"
      },
      {
        "id": "glyph_quill",
        "name": "Glyph Quill",
        "effect": "writes_journal_placeholder",
        "material": "glyph_quill_sigil_placeholder"
      },
      {
        "id": "mirror_lens",
        "name": "Mirror Lens",
        "effect": "changes_visual_mood",
        "material": "mirror_lens_sigil_placeholder"
      },
      {
        "id": "lamp_of_forms",
        "name": "Lamp of Forms",
        "effect": "spawns_forms_lights_mirrors",
        "material": "lamp_of_forms_sigil_placeholder"
      }
    ]
  },
  "forms": [],
  "atmosphere": {
    "lighting": {
      "intensity": 1.357,
      "colorTemperature": 5950,
      "placeholder": "UE LightComponent intensity/color"
    },
    "fog": {
      "density": 0.21,
      "placeholder": "UE ExponentialHeightFog density"
    },
    "postProcess": {
      "bloom": 0.815,
      "exposure": 1.12,
      "placeholder": "UE PostProcessVolume bloom/exposure"
    },
    "audio": {
      "parameterMood": "calm_hopeful_boundless_bright_warm",
      "placeholder": "ambient_calm_hopeful_boundless_bright_warm"
    },
    "movement": {
      "feel": "drifting, slow acceleration placeholder",
      "gravityScale": 0.825
    },
    "thermalHint": "warm"
  },
  "dreamAtmosphere": {
    "schema": "DreamAtmospherePresentationV1",
    "schemaVersion": 1,
    "weatherId": "weather-777",
    "mood": "stillness",
    "pressure": "medium",
    "weatherTags": [
      "silence",
      "threshold",
      "dissolution",
      "memory"
    ],
    "lighting": {
      "intensityScale": 0.626,
      "bloom": 0.246,
      "exposure": 0.42,
      "flicker": 0.072,
      "warmth": 0.519
    },
    "fog": {
      "density": 0.37,
      "drift": 0.232,
      "veil": 0.14
    },
    "audio": {
      "tension": 0.203,
      "reverb": 0.308,
      "lowPass": 0.088,
      "silence": 0.65
    },
    "haptics": {
      "enabled": true,
      "amplitude": 0.142,
      "pulseRate": 0.248
    },
    "movement": {
      "drag": 0.318,
      "drift": 0.096,
      "steadinessAssist": 0.797
    },
    "comfort": {
      "ceiling": 0.44,
      "suddenFlashAllowed": false,
      "pursuitAllowed": true,
      "locomotionIntensity": 0.42,
      "returnAnchorKind": "image"
    }
  }
}
